{
	"concurrency" : 8,
	"batch_size" : 500,
	"input" : {
		"filename" : "us_places.factual.v3_40.1460184797.tab",
		"encoding" : "utf-8"
	},
	"logging" : {
		"level" : "info",
		"path" : "out.log",
		"formatter" : "%(asctime)s - %(name)s - %(levelname)s - %(message)s",
		"console" : false
	},
	"elasticsearch" : {
		"cluster_nodes" : [
			"search-keyvalue-pcq5ynjmu6erk2logbfkwbwfo4.us-west-2.es.amazonaws.com:80"
        ],
		"index" : "factual_index",
		"type" : "factual_type",
		"boost_labels" : [ "query_string" ],
		"boost_vectors" : {
			"factual_id" :        [ 0.0 ],
			"name" :              [ 1.0 ],
			"detail":             [ 0.0 ]
		},
		"composite_fields" : [
			{
				"address" : {
					"components" : [ "address", "address_extended", "locality", "region",
						"postcode", "country" ],
					"format" : "{0} {1} {2}, {3} {4}, {5}",
					"index" : "not_analyzed",
					"type" : "string"
				}
			}
		],
		"dispersed_fields" : [
			{
				"address": {
					"dispersion_regex" : "^(?P<number_part>\\w+)\\s+(?P<street_part>.+)$",
					"components" : [
						{
							"name" : "number_part",
							"index" : "not_analyzed",
							"type" : "string"
						},
						{
							"name" : "street_part",
							"index" : "not_analyzed",
							"type" : "string"
						}
					]
				}
			}
		],
		"type_mapping" : {
			"mappings" : {
				"factual_type" : {
					"_source" : {
						"enabled" : true
					},
					"properties" : {
						"factual_id" : { "index" : "not_analyzed", "type" : "string" },
						"name" : { "index" : "analyzed", "type" : "string" },
						"detail" : { "index" : "not_analyzed", "type" : "string" }
					}
				}
			},
			"settings" : {
				"number_of_replicas" : 0,
				"number_of_shards" : 10
			}
		},
		"comment" : {
			"_routing" : {
				"required" : false,
				"path" : "region"
			}
		}
	}
}
